{
  "author": "nishiuriraku",
  "author_github": "nishiuriraku",
  "author_pubkey_id": "da6d0d6a02195db0",
  "download_url": "https://raw.githubusercontent.com/nishiuriraku/easy-cursor-swap-index/main/themes/d02c4e77-0324-41e4-8cfb-9e92ef6471eb.cursorpack",
  "id": "d02c4e77-0324-41e4-8cfb-9e92ef6471eb",
  "included_roles": [
    "SizeNS",
    "Crosshair",
    "AppStarting",
    "SizeAll",
    "Arrow",
    "SizeNESW",
    "UpArrow",
    "SizeNWSE",
    "Pin",
    "Hand",
    "NWPen",
    "Person",
    "SizeWE",
    "Wait",
    "No",
    "IBeam",
    "Help"
  ],
  "name": "EasyCursorSwap Carbon",
  "preview_base_url": "https://raw.githubusercontent.com/nishiuriraku/easy-cursor-swap-index/main/previews/d02c4e77-0324-41e4-8cfb-9e92ef6471eb",
  "sha256": "9f1a2b833fbe433fc5f4987fad5cf595cf0eda300753561969b4a12af4276958",
  "signature": "Yt7z4wwy5v4BNUtragEqSVNFzNfguXpGSBpLhcmmu/pwYZFhEqXxACmq9FE57gHu/K1gRLaY0SsMsdWC+Y8pAA==",
  "tags": [],
  "version": "1.0.0"
}