{
  "author": "nishiuriraku",
  "author_github": "nishiuriraku",
  "author_pubkey_id": "da6d0d6a02195db0",
  "download_url": "https://raw.githubusercontent.com/nishiuriraku/easy-cursor-swap-index/main/themes/ccf28a90-a370-4f0e-ae7c-baf85335869c.cursorpack",
  "id": "ccf28a90-a370-4f0e-ae7c-baf85335869c",
  "included_roles": [
    "AppStarting",
    "IBeam",
    "Crosshair",
    "Arrow",
    "SizeAll",
    "Help",
    "UpArrow",
    "SizeWE",
    "SizeNS",
    "SizeNESW",
    "Hand",
    "SizeNWSE",
    "NWPen",
    "Person",
    "No",
    "Wait",
    "Pin"
  ],
  "name": {
    "ja": "EasyCursorSwap Violet Dusk",
    "en": "EasyCursorSwap Violet Dusk"
  },
  "preview_base_url": "https://raw.githubusercontent.com/nishiuriraku/easy-cursor-swap-index/main/previews/ccf28a90-a370-4f0e-ae7c-baf85335869c",
  "sha256": "2a647997f9610b8c5a45e9600e7f84645800434069874568b5fe34c7894a95da",
  "signature": "Pku2+d5zyIsISwT7cOcpi82ToyqLS4n8//u2hcpX8fyD4uyet91dEhkdsgAuYdY8yAp5o320VnfABEeJzGh0BA==",
  "tags": [],
  "version": "1.0.0"
}