{
  "id": "b6526c67-4feb-4168-a42e-f9bd027e4959",
  "name": {
    "ja": "EasyCursorSwap Mint",
    "en": "EasyCursorSwap Mint"
  },
  "author": "nishiuriraku",
  "author_github": "nishiuriraku",
  "author_pubkey_id": "da6d0d6a02195db0",
  "sha256": "1d472d6f91fe84307c3219287109ab2036e21c9473ff201f2ef70fea86fc096d",
  "signature": "D2hVJa+nCjRt9Dbp7DypP5TzQWYFDXz9a/D3qzhm15RQcm7f7lSBv8pD3CmW4ymzhNDM49jBTZTsMd886OrGBA==",
  "download_url": "https://raw.githubusercontent.com/nishiuriraku/easy-cursor-swap-index/main/themes/b6526c67-4feb-4168-a42e-f9bd027e4959.cursorpack",
  "version": "1.0.0",
  "size_bytes": 675778,
  "included_roles": [
    "Arrow",
    "Help",
    "AppStarting",
    "Wait",
    "Crosshair",
    "IBeam",
    "NWPen",
    "No",
    "SizeNS",
    "SizeWE",
    "SizeNWSE",
    "SizeNESW",
    "SizeAll",
    "UpArrow",
    "Hand",
    "Pin",
    "Person"
  ],
  "tags": ["minimal"],
  "published_at": "2026-05-13T14:34:09Z"
}
