{
  "author": "nishiuriraku",
  "author_github": "nishiuriraku",
  "author_pubkey_id": "da6d0d6a02195db0",
  "download_url": "https://raw.githubusercontent.com/nishiuriraku/easy-cursor-swap-index/main/themes/ae3380ae-0c7c-4e2e-bcd6-9b1621528c8f.cursorpack",
  "id": "ae3380ae-0c7c-4e2e-bcd6-9b1621528c8f",
  "included_roles": [
    "SizeNESW",
    "Help",
    "SizeNWSE",
    "Pin",
    "Wait",
    "AppStarting",
    "No",
    "Arrow",
    "NWPen",
    "IBeam",
    "SizeAll",
    "Hand",
    "UpArrow",
    "Crosshair",
    "SizeWE",
    "Person",
    "SizeNS"
  ],
  "name": "EasyCursorSwap Neon Wire",
  "sha256": "d8f70202bb33673f980c3e4ba8b8caa93dbb5c35a6f15064d41a89330d3bc3de",
  "signature": "xh00E82KJTjqY40yRYw99MvLg2yXOxyPEsllrYXi5nz5Cso9F/6NcnQDToT7vuhh9q848qltKQ/xCdgVVFDdBw==",
  "tags": [],
  "version": "1.0.0"
}