{
  "id": "6d364941-c605-4def-801a-14ebb401936f",
  "name": {
    "ja": "EasyCursorSwap Mint",
    "en": "EasyCursorSwap Mint"
  },
  "description": {
    "ja": "アプリアイコン直系。ミントグラデ + ダークアウトライン。デフォルトで適用される基準テーマ。",
    "en": "Derived from the app icon. Mint gradient + dark outline. The reference theme applied by default."
  },
  "author": "nishiuriraku",
  "author_github": "nishiuriraku",
  "author_pubkey_id": "da6d0d6a02195db0",
  "sha256": "3669cbd06197ea339871795d1aa9748e9c24a6f3880d72e19c8c9f855abef60a",
  "signature": "V5mrGhoe9JEqEH7LHurUkoWAHvW6jVqgGJCid2qbrx30U0I3qDODYsVNiB3+2Q8PgthWiGI2a3GR9vUO5WNJDQ==",
  "download_url": "https://raw.githubusercontent.com/nishiuriraku/easy-cursor-swap-index/main/themes/6d364941-c605-4def-801a-14ebb401936f.cursorpack",
  "version": "1.0.0",
  "size_bytes": 694793,
  "included_roles": [
    "Arrow",
    "Help",
    "AppStarting",
    "Wait",
    "Crosshair",
    "IBeam",
    "NWPen",
    "No",
    "SizeNS",
    "SizeWE",
    "SizeNWSE",
    "SizeNESW",
    "SizeAll",
    "UpArrow",
    "Hand",
    "Pin",
    "Person"
  ],
  "tags": ["minimal"],
  "highlight": "new",
  "download_count": 0,
  "verified": true,
  "published_at": "2026-05-14T04:36:10Z"
}
