{
  "author": "nishiuriraku",
  "author_github": "nishiuriraku",
  "author_pubkey_id": "da6d0d6a02195db0",
  "download_url": "https://raw.githubusercontent.com/nishiuriraku/easy-cursor-swap-index/main/themes/e44f8d62-4a60-4c0b-a0c6-87681b477662.cursorpack",
  "id": "e44f8d62-4a60-4c0b-a0c6-87681b477662",
  "included_roles": [
    "Pin",
    "Person",
    "SizeAll",
    "SizeNWSE",
    "Hand",
    "SizeWE",
    "Wait",
    "Help",
    "Arrow",
    "SizeNS",
    "SizeNESW",
    "AppStarting",
    "UpArrow",
    "NWPen",
    "Crosshair",
    "No",
    "IBeam"
  ],
  "name": {
    "ja": "EasyCursorSwap Coral Sunset",
    "en": "EasyCursorSwap Coral Sunset"
  },
  "preview_base_url": "https://raw.githubusercontent.com/nishiuriraku/easy-cursor-swap-index/main/previews/e44f8d62-4a60-4c0b-a0c6-87681b477662",
  "sha256": "346601d024f401a5c5c8de8abaf04b1e1917f9d60680514452e9633fdbc82455",
  "signature": "DNdIe87sTAN9zWY+Fbkqbmh+1l9QA5+tFlTmeNdD3GTAC8f9PDM06Daw4naxvUq0I8jompWzkvSTr54J6y20Aw==",
  "tags": [],
  "version": "1.0.0"
}