{
  "author": "nishiuriraku",
  "author_github": "nishiuriraku",
  "author_pubkey_id": "da6d0d6a02195db0",
  "download_url": "https://raw.githubusercontent.com/nishiuriraku/easy-cursor-swap-index/main/themes/c0c16bb5-bf65-47a1-a417-068661fe6f0a.cursorpack",
  "id": "c0c16bb5-bf65-47a1-a417-068661fe6f0a",
  "included_roles": [
    "Crosshair",
    "SizeNESW",
    "SizeNS",
    "Person",
    "Arrow",
    "IBeam",
    "Pin",
    "SizeNWSE",
    "NWPen",
    "SizeAll",
    "No",
    "Wait",
    "AppStarting",
    "Help",
    "UpArrow",
    "Hand",
    "SizeWE"
  ],
  "name": "EasyCursorSwap Sakura",
  "preview_base_url": "https://raw.githubusercontent.com/nishiuriraku/easy-cursor-swap-index/main/previews/c0c16bb5-bf65-47a1-a417-068661fe6f0a",
  "sha256": "75fe262c7a82dc32c55eda21363c52b13fb1137bfded9929980ff07605b5da31",
  "signature": "sUUQXhvltpntDR6KdnfvOUSWIDSAOrT2xu8Wj1+sE8C//58yxRpoSKqyNTZCb/wopWLxg2DAAcXj+vsm4V1KDA==",
  "tags": [],
  "version": "1.0.0"
}