{
  "id": "ea976f90-e612-494f-a0a9-bd30c5c13871",
  "name": {
    "ja": "easy-cursor-swap-mint",
    "en": "EasyCursorSwap Mint"
  },
  "author": "nishiuriraku",
  "author_github": "nishiuriraku",
  "author_pubkey_id": "da6d0d6a02195db0",
  "sha256": "f29e5e5ad5914974ff3332df041473c61723305ce366e82ee6ba608b3945be42",
  "signature": "E2gSR+QAgRwUd3T4LJQtjJelRwlNbIZAIQ0Db3Ve9VxklaLkDbW0aYSEwKqdl9BbzGQib+ig2Xh7zkGlQfYbCQ==",
  "download_url": "https://raw.githubusercontent.com/nishiuriraku/easy-cursor-swap-index/main/themes/ea976f90-e612-494f-a0a9-bd30c5c13871.cursorpack",
  "version": "1.0.0",
  "size_bytes": 675524,
  "included_roles": [
    "Arrow",
    "Help",
    "AppStarting",
    "Wait",
    "Crosshair",
    "IBeam",
    "NWPen",
    "No",
    "SizeNS",
    "SizeWE",
    "SizeNWSE",
    "SizeNESW",
    "SizeAll",
    "UpArrow",
    "Hand",
    "Pin",
    "Person"
  ],
  "tags": ["minimal"],
  "published_at": "2026-05-08T18:29:05Z"
}
